[
  {
    "id": "artificer-armour-gladius-task-force-adeptus-astartes",
    "name": "Artificer Armour",
    "detachment_id": "gladius-task-force",
    "cost": 15,
    "keyword_restrictions": [
      "Adeptus Astartes"
    ],
    "ability_id": "artificer-armour-gladius-task-force-adeptus-astartes",
    "is_unique": true,
    "game_version": {
      "edition": "11th",
      "dataslate": "mfm-995"
    },
    "points_provisional": false,
    "upgrade_tag": false,
    "max_targets": 1,
    "external_refs": [
      {
        "namespace": "game-datacards",
        "id": "4d709e6f-5df2-5dad-9336-f1c45dc51538"
      },
      {
        "namespace": "mfm",
        "id": "bb667268-b5f1-4de4-b708-885b045b4938"
      }
    ]
  },
  {
    "id": "adept-of-the-codex-gladius-task-force-adeptus-astartes",
    "name": "Adept of the Codex",
    "detachment_id": "gladius-task-force",
    "cost": 20,
    "keyword_restrictions": [
      "Captain"
    ],
    "ability_id": "adept-of-the-codex-gladius-task-force-adeptus-astartes",
    "is_unique": true,
    "game_version": {
      "edition": "11th",
      "dataslate": "mfm-995"
    },
    "points_provisional": false,
    "upgrade_tag": false,
    "max_targets": 1,
    "external_refs": [
      {
        "namespace": "game-datacards",
        "id": "9cb3de18-43d4-5460-bdc2-6ae1e0ddf250"
      },
      {
        "namespace": "mfm",
        "id": "8fc10e42-2978-43da-92e9-636e5e4ce564"
      }
    ]
  },
  {
    "id": "the-flesh-is-weak-medusas-wrath-iron-hands",
    "external_refs": [
      {
        "namespace": "mfm",
        "id": "ea8f1467-f19c-463e-9c19-82201e5a7dd1"
      }
    ],
    "name": "The Flesh is Weak",
    "detachment_id": "medusas-wrath",
    "cost": 15,
    "ability_id": "the-flesh-is-weak-medusas-wrath-iron-hands",
    "is_unique": true,
    "game_version": {
      "edition": "11th",
      "dataslate": "mfm-995"
    },
    "points_provisional": false,
    "upgrade_tag": false,
    "max_targets": 1,
    "keyword_restrictions": [
      "Adeptus Astartes"
    ]
  },
  {
    "id": "target-augury-web-medusas-wrath-iron-hands",
    "external_refs": [
      {
        "namespace": "mfm",
        "id": "219c6b75-1941-426f-9ab1-c3e8f6ebeffa"
      }
    ],
    "name": "Target Augury Web",
    "detachment_id": "medusas-wrath",
    "cost": 30,
    "ability_id": "target-augury-web-medusas-wrath-iron-hands",
    "is_unique": true,
    "game_version": {
      "edition": "11th",
      "dataslate": "mfm-995"
    },
    "points_provisional": false,
    "upgrade_tag": false,
    "max_targets": 1,
    "keyword_restrictions": [
      "Techmarine"
    ]
  },
  {
    "id": "master-of-the-machine-war-medusas-wrath-iron-hands",
    "external_refs": [
      {
        "namespace": "mfm",
        "id": "e7855ea6-f1bd-417a-8b5c-f307ec5a8d84"
      }
    ],
    "name": "Master of the Machine War",
    "detachment_id": "medusas-wrath",
    "cost": 25,
    "ability_id": "master-of-the-machine-war-medusas-wrath-iron-hands",
    "is_unique": true,
    "game_version": {
      "edition": "11th",
      "dataslate": "mfm-995"
    },
    "points_provisional": false,
    "upgrade_tag": false,
    "max_targets": 1,
    "keyword_restrictions": [
      "Adeptus Astartes"
    ]
  },
  {
    "id": "adept-of-the-omnissiah-medusas-wrath-iron-hands",
    "external_refs": [
      {
        "namespace": "mfm",
        "id": "9eebda23-0cb4-46c6-80ec-3254c1f4a421"
      }
    ],
    "name": "Adept of the Omnissiah",
    "detachment_id": "medusas-wrath",
    "cost": 25,
    "ability_id": "adept-of-the-omnissiah-medusas-wrath-iron-hands",
    "is_unique": true,
    "game_version": {
      "edition": "11th",
      "dataslate": "mfm-995"
    },
    "points_provisional": false,
    "upgrade_tag": false,
    "max_targets": 1,
    "keyword_restrictions": [
      "Techmarine"
    ]
  }
]
