[
  {
    "id": "prescient-flash-angelic-inheritors-blood-angels",
    "name": "Prescient Flash",
    "detachment_id": "angelic-inheritors",
    "cost": 25,
    "keyword_restrictions": [
      "Adeptus Astartes"
    ],
    "ability_id": "prescient-flash-angelic-inheritors-blood-angels",
    "is_unique": true,
    "game_version": {
      "edition": "11th",
      "dataslate": "mfm-995"
    },
    "points_provisional": false,
    "upgrade_tag": false,
    "max_targets": 1,
    "external_refs": [
      {
        "namespace": "game-datacards",
        "id": "6c6dbbba-ae06-5fe6-b07f-41fcf8472832"
      },
      {
        "namespace": "mfm",
        "id": "037bc931-f00a-4906-812c-b1832ffe0155"
      }
    ]
  },
  {
    "id": "blazing-icon-angelic-inheritors-blood-angels",
    "name": "Blazing Icon",
    "detachment_id": "angelic-inheritors",
    "cost": 20,
    "keyword_restrictions": [
      "Adeptus Astartes"
    ],
    "ability_id": "blazing-icon-angelic-inheritors-blood-angels",
    "is_unique": true,
    "game_version": {
      "edition": "11th",
      "dataslate": "mfm-995"
    },
    "points_provisional": false,
    "upgrade_tag": false,
    "max_targets": 1,
    "external_refs": [
      {
        "namespace": "game-datacards",
        "id": "3fa7a310-b6ea-51f7-be47-84c42077d5cc"
      },
      {
        "namespace": "mfm",
        "id": "44447a1a-2341-4c85-a4fc-ee40380a2834"
      }
    ]
  },
  {
    "id": "ordained-sacrifice-angelic-inheritors-blood-angels",
    "name": "Ordained Sacrifice",
    "detachment_id": "angelic-inheritors",
    "cost": 25,
    "keyword_restrictions": [
      "Adeptus Astartes"
    ],
    "ability_id": "ordained-sacrifice-angelic-inheritors-blood-angels",
    "is_unique": true,
    "game_version": {
      "edition": "11th",
      "dataslate": "mfm-995"
    },
    "points_provisional": false,
    "upgrade_tag": false,
    "max_targets": 1,
    "external_refs": [
      {
        "namespace": "game-datacards",
        "id": "f39fc1d9-5ea6-5563-9cb9-10baeefb02ec"
      },
      {
        "namespace": "mfm",
        "id": "490323b4-cc6a-482d-a595-2d7e487d05d3"
      }
    ]
  },
  {
    "id": "angelic-executioner-encarmine-speartip-blood-angels",
    "name": "Angelic Executioner",
    "detachment_id": "encarmine-speartip",
    "cost": 20,
    "keyword_restrictions": [
      "Adeptus Astartes",
      "Jump Pack"
    ],
    "ability_id": "angelic-executioner-encarmine-speartip-blood-angels",
    "is_unique": true,
    "game_version": {
      "edition": "11th",
      "dataslate": "mfm-995"
    },
    "points_provisional": false,
    "upgrade_tag": false,
    "max_targets": 1,
    "external_refs": [
      {
        "namespace": "game-datacards",
        "id": "22e76857-6271-526f-9577-7972408ca469"
      },
      {
        "namespace": "mfm",
        "id": "56b4ffc0-1976-4b75-8160-a63e7ea958f5"
      }
    ]
  },
  {
    "id": "shadow-of-abomination-encarmine-speartip-blood-angels",
    "name": "Shadow of Abomination",
    "detachment_id": "encarmine-speartip",
    "cost": 15,
    "keyword_restrictions": [
      "Adeptus Astartes",
      "Jump Pack"
    ],
    "ability_id": "shadow-of-abomination-encarmine-speartip-blood-angels",
    "is_unique": true,
    "game_version": {
      "edition": "11th",
      "dataslate": "mfm-995"
    },
    "points_provisional": false,
    "upgrade_tag": false,
    "max_targets": 1,
    "external_refs": [
      {
        "namespace": "game-datacards",
        "id": "ab1166fd-7f63-5a1d-b69b-46c8abcd6bd5"
      },
      {
        "namespace": "mfm",
        "id": "3e1533b5-dd19-4d7b-9a07-b893c2b6597d"
      }
    ]
  },
  {
    "id": "instinctive-interception-wrath-of-the-doomed-blood-angels",
    "name": "Instinctive Interception",
    "detachment_id": "wrath-of-the-doomed",
    "cost": 10,
    "keyword_restrictions": [
      "Death Company"
    ],
    "ability_id": "instinctive-interception-wrath-of-the-doomed-blood-angels",
    "is_unique": true,
    "game_version": {
      "edition": "11th",
      "dataslate": "mfm-995"
    },
    "points_provisional": false,
    "upgrade_tag": false,
    "max_targets": 1,
    "external_refs": [
      {
        "namespace": "game-datacards",
        "id": "cd8d2866-45c2-5069-9156-a2fe94acb66b"
      },
      {
        "namespace": "mfm",
        "id": "112d3c16-0c99-4e93-aeb7-71dcfe5a14c7"
      }
    ]
  },
  {
    "id": "artificer-armour-gladius-task-force-adeptus-astartes",
    "name": "Artificer Armour",
    "detachment_id": "gladius-task-force",
    "cost": 15,
    "keyword_restrictions": [
      "Adeptus Astartes"
    ],
    "ability_id": "artificer-armour-gladius-task-force-adeptus-astartes",
    "is_unique": true,
    "game_version": {
      "edition": "11th",
      "dataslate": "mfm-995"
    },
    "points_provisional": false,
    "upgrade_tag": false,
    "max_targets": 1,
    "external_refs": [
      {
        "namespace": "game-datacards",
        "id": "4d709e6f-5df2-5dad-9336-f1c45dc51538"
      },
      {
        "namespace": "mfm",
        "id": "bb667268-b5f1-4de4-b708-885b045b4938"
      }
    ]
  },
  {
    "id": "adept-of-the-codex-gladius-task-force-adeptus-astartes",
    "name": "Adept of the Codex",
    "detachment_id": "gladius-task-force",
    "cost": 20,
    "keyword_restrictions": [
      "Captain"
    ],
    "ability_id": "adept-of-the-codex-gladius-task-force-adeptus-astartes",
    "is_unique": true,
    "game_version": {
      "edition": "11th",
      "dataslate": "mfm-995"
    },
    "points_provisional": false,
    "upgrade_tag": false,
    "max_targets": 1,
    "external_refs": [
      {
        "namespace": "game-datacards",
        "id": "9cb3de18-43d4-5460-bdc2-6ae1e0ddf250"
      },
      {
        "namespace": "mfm",
        "id": "8fc10e42-2978-43da-92e9-636e5e4ce564"
      }
    ],
    "datasheet_restriction_groups": [
      {
        "unit_id": "captain"
      }
    ]
  },
  {
    "id": "masterful-fighter-sanguinary-spearhead-blood-angels",
    "name": "Masterful Fighter",
    "detachment_id": "sanguinary-spearhead",
    "cost": 0,
    "is_unique": true,
    "game_version": {
      "edition": "11th",
      "dataslate": "mfm-995"
    },
    "game_modes": [
      "combat-patrol"
    ],
    "points_provisional": false,
    "keyword_restrictions": [
      "Captain",
      "Sanguinary Spearhead"
    ],
    "ability_id": "masterful-fighter-sanguinary-spearhead-blood-angels",
    "external_refs": [
      {
        "namespace": "mfm",
        "id": "51ee8286-2787-4427-8df3-d5ccea9bab9f"
      }
    ]
  },
  {
    "id": "overwhelming-charge-sanguinary-spearhead-blood-angels",
    "name": "Overwhelming Charge",
    "detachment_id": "sanguinary-spearhead",
    "cost": 0,
    "is_unique": true,
    "game_version": {
      "edition": "11th",
      "dataslate": "mfm-995"
    },
    "game_modes": [
      "combat-patrol"
    ],
    "points_provisional": false,
    "upgrade_tag": true,
    "ability_id": "overwhelming-charge-sanguinary-spearhead-blood-angels",
    "external_refs": [
      {
        "namespace": "mfm",
        "id": "93bc2948-1a09-48b0-ac3e-d993f4008a0d"
      }
    ],
    "datasheet_restriction_groups": [
      {
        "unit_id": "sanguinary-spearhead-assault-intercessor-squad"
      }
    ]
  },
  {
    "id": "on-the-archtraitors-bridge-wrath-of-the-doomed-blood-angels",
    "name": "On the Archtraitor's Bridge",
    "detachment_id": "wrath-of-the-doomed",
    "cost": 20,
    "ability_id": "on-the-archtraitors-bridge-wrath-of-the-doomed-blood-angels",
    "is_unique": true,
    "game_version": {
      "edition": "11th",
      "dataslate": "mfm-995"
    },
    "points_provisional": false,
    "upgrade_tag": false,
    "max_targets": 1,
    "keyword_restrictions": [
      "Death Company"
    ],
    "external_refs": [
      {
        "namespace": "game-datacards",
        "id": "51383e5a-5ae4-5a47-bf28-76826585e08d"
      },
      {
        "namespace": "mfm",
        "id": "61e24748-9513-4fb7-8812-9515e8b3f403"
      }
    ]
  },
  {
    "id": "unto-death-angelic-inheritors-blood-angels",
    "external_refs": [
      {
        "namespace": "mfm",
        "id": "be5873e7-ce5e-4af5-8679-f4001036333c"
      }
    ],
    "name": "Unto Death",
    "detachment_id": "angelic-inheritors",
    "cost": 15,
    "ability_id": "unto-death-angelic-inheritors-blood-angels",
    "is_unique": true,
    "game_version": {
      "edition": "11th",
      "dataslate": "mfm-995"
    },
    "points_provisional": false,
    "upgrade_tag": false,
    "max_targets": 1,
    "keyword_restrictions": [
      "Adeptus Astartes"
    ]
  }
]
