[
  {
    "id": "armour-of-antoninus-blade-of-ultramar-ultramarines",
    "name": "Armour of Antoninus",
    "detachment_id": "blade-of-ultramar",
    "cost": 15,
    "keyword_restrictions": [
      "Adeptus Astartes"
    ],
    "ability_id": "armour-of-antoninus-blade-of-ultramar-ultramarines",
    "is_unique": true,
    "game_version": {
      "edition": "11th",
      "dataslate": "mfm-995"
    },
    "points_provisional": false,
    "upgrade_tag": false,
    "max_targets": 1,
    "external_refs": [
      {
        "namespace": "game-datacards",
        "id": "e8e9f3b5-271a-521a-86b1-caed74450e46"
      },
      {
        "namespace": "mfm",
        "id": "8d7f8864-e28e-45c7-8155-9b2c5c5b6b0f"
      }
    ]
  },
  {
    "id": "oath-of-macragge-blade-of-ultramar-ultramarines",
    "name": "Oath of Macragge",
    "detachment_id": "blade-of-ultramar",
    "cost": 20,
    "keyword_restrictions": [
      "Adeptus Astartes"
    ],
    "ability_id": "oath-of-macragge-blade-of-ultramar-ultramarines",
    "is_unique": true,
    "game_version": {
      "edition": "11th",
      "dataslate": "mfm-995"
    },
    "points_provisional": false,
    "upgrade_tag": false,
    "max_targets": 1,
    "external_refs": [
      {
        "namespace": "game-datacards",
        "id": "6da32fde-f782-5a28-99c7-5c0419a6d374"
      },
      {
        "namespace": "mfm",
        "id": "984ee9d6-627c-4fe1-9416-062395285c9b"
      }
    ]
  },
  {
    "id": "student-of-the-codex-blade-of-ultramar-ultramarines",
    "name": "Student of the Codex",
    "detachment_id": "blade-of-ultramar",
    "cost": 20,
    "keyword_restrictions": [
      "Captain"
    ],
    "ability_id": "student-of-the-codex-blade-of-ultramar-ultramarines",
    "is_unique": true,
    "game_version": {
      "edition": "11th",
      "dataslate": "mfm-995"
    },
    "points_provisional": false,
    "upgrade_tag": false,
    "max_targets": 1,
    "external_refs": [
      {
        "namespace": "game-datacards",
        "id": "243b6f9e-ab4a-512f-b805-92e0e05f82fb"
      },
      {
        "namespace": "mfm",
        "id": "1f56a6d4-45ac-4735-a563-b23f1c0f2569"
      }
    ]
  },
  {
    "id": "veteran-of-behemoth-blade-of-ultramar-ultramarines",
    "name": "Veteran of Behemoth",
    "detachment_id": "blade-of-ultramar",
    "cost": 20,
    "keyword_restrictions": [
      "Adeptus Astartes"
    ],
    "ability_id": "veteran-of-behemoth-blade-of-ultramar-ultramarines",
    "is_unique": true,
    "game_version": {
      "edition": "11th",
      "dataslate": "mfm-995"
    },
    "points_provisional": false,
    "upgrade_tag": false,
    "max_targets": 1,
    "external_refs": [
      {
        "namespace": "game-datacards",
        "id": "2df5449f-5b79-5b31-ba8c-a8434104aa9c"
      },
      {
        "namespace": "mfm",
        "id": "c4539484-5c56-4bc0-ac5d-363c51d4e6a4"
      }
    ]
  },
  {
    "id": "artificer-armour-gladius-task-force-adeptus-astartes",
    "name": "Artificer Armour",
    "detachment_id": "gladius-task-force",
    "cost": 15,
    "keyword_restrictions": [
      "Adeptus Astartes"
    ],
    "ability_id": "artificer-armour-gladius-task-force-adeptus-astartes",
    "is_unique": true,
    "game_version": {
      "edition": "11th",
      "dataslate": "mfm-995"
    },
    "points_provisional": false,
    "upgrade_tag": false,
    "max_targets": 1,
    "external_refs": [
      {
        "namespace": "game-datacards",
        "id": "4d709e6f-5df2-5dad-9336-f1c45dc51538"
      },
      {
        "namespace": "mfm",
        "id": "bb667268-b5f1-4de4-b708-885b045b4938"
      }
    ]
  },
  {
    "id": "adept-of-the-codex-gladius-task-force-adeptus-astartes",
    "name": "Adept of the Codex",
    "detachment_id": "gladius-task-force",
    "cost": 20,
    "keyword_restrictions": [
      "Captain"
    ],
    "ability_id": "adept-of-the-codex-gladius-task-force-adeptus-astartes",
    "is_unique": true,
    "game_version": {
      "edition": "11th",
      "dataslate": "mfm-995"
    },
    "points_provisional": false,
    "upgrade_tag": false,
    "max_targets": 1,
    "external_refs": [
      {
        "namespace": "game-datacards",
        "id": "9cb3de18-43d4-5460-bdc2-6ae1e0ddf250"
      },
      {
        "namespace": "mfm",
        "id": "8fc10e42-2978-43da-92e9-636e5e4ce564"
      }
    ]
  }
]
