[
  {
    "id": "spearpoint-paragon-spearpoint-task-force-white-scars",
    "name": "Spearpoint Paragon",
    "detachment_id": "spearpoint-task-force",
    "cost": 25,
    "keyword_restrictions": [
      "Adeptus Astartes"
    ],
    "ability_id": "spearpoint-paragon-spearpoint-task-force-white-scars",
    "is_unique": true,
    "game_version": {
      "edition": "11th",
      "dataslate": "mfm-995"
    },
    "points_provisional": false,
    "upgrade_tag": false,
    "max_targets": 1,
    "external_refs": [
      {
        "namespace": "game-datacards",
        "id": "ed1ca0fd-79a4-5e96-8cab-734a4f74de48"
      },
      {
        "namespace": "mfm",
        "id": "c02233e1-25d9-4ffd-8fed-5b5e18b8fa4d"
      }
    ]
  },
  {
    "id": "stormseers-wisdom-spearpoint-task-force-white-scars",
    "name": "Stormseer's Wisdom",
    "detachment_id": "spearpoint-task-force",
    "cost": 15,
    "keyword_restrictions": [
      "Adeptus Astartes"
    ],
    "ability_id": "stormseers-wisdom-spearpoint-task-force-white-scars",
    "is_unique": true,
    "game_version": {
      "edition": "11th",
      "dataslate": "mfm-995"
    },
    "points_provisional": false,
    "upgrade_tag": false,
    "max_targets": 1,
    "external_refs": [
      {
        "namespace": "game-datacards",
        "id": "d8853214-0e0c-5c5c-84dd-41a760daa233"
      },
      {
        "namespace": "mfm",
        "id": "460506fe-ac31-4cf3-8a0d-fe558f1d4f99"
      }
    ]
  },
  {
    "id": "hunters-eye-spearpoint-task-force-white-scars",
    "name": "Hunter's Eye",
    "detachment_id": "spearpoint-task-force",
    "cost": 25,
    "keyword_restrictions": [
      "Adeptus Astartes"
    ],
    "ability_id": "hunters-eye-spearpoint-task-force-white-scars",
    "is_unique": true,
    "game_version": {
      "edition": "11th",
      "dataslate": "mfm-995"
    },
    "points_provisional": false,
    "upgrade_tag": false,
    "max_targets": 1,
    "external_refs": [
      {
        "namespace": "game-datacards",
        "id": "074fa6f1-5208-5e81-befb-81e97287c2ac"
      },
      {
        "namespace": "mfm",
        "id": "8134f4d8-c7c7-47f0-8db3-6ca27ffd5d2f"
      }
    ]
  },
  {
    "id": "chogorian-huntmaster-upgrade-spearpoint-task-force-white-scars",
    "name": "Chogorian Huntmaster (Upgrade)",
    "detachment_id": "spearpoint-task-force",
    "cost": 20,
    "ability_id": "chogorian-huntmaster-upgrade-spearpoint-task-force-white-scars",
    "is_unique": true,
    "game_version": {
      "edition": "11th",
      "dataslate": "mfm-995"
    },
    "points_provisional": false,
    "upgrade_tag": true,
    "max_targets": 3,
    "external_refs": [
      {
        "namespace": "game-datacards",
        "id": "ca53e5c0-365f-51a1-91ce-a15af5d2308e"
      },
      {
        "namespace": "mfm",
        "id": "5d8058f9-bfbe-42ee-bc2e-6bc6f717319f"
      }
    ],
    "keyword_restriction_groups": [
      [
        "Adeptus Astartes",
        "Mounted"
      ],
      [
        "Adeptus Astartes",
        "Speeder"
      ]
    ]
  },
  {
    "id": "artificer-armour-gladius-task-force-adeptus-astartes",
    "name": "Artificer Armour",
    "detachment_id": "gladius-task-force",
    "cost": 15,
    "keyword_restrictions": [
      "Adeptus Astartes"
    ],
    "ability_id": "artificer-armour-gladius-task-force-adeptus-astartes",
    "is_unique": true,
    "game_version": {
      "edition": "11th",
      "dataslate": "mfm-995"
    },
    "points_provisional": false,
    "upgrade_tag": false,
    "max_targets": 1,
    "external_refs": [
      {
        "namespace": "game-datacards",
        "id": "4d709e6f-5df2-5dad-9336-f1c45dc51538"
      },
      {
        "namespace": "mfm",
        "id": "bb667268-b5f1-4de4-b708-885b045b4938"
      }
    ]
  },
  {
    "id": "adept-of-the-codex-gladius-task-force-adeptus-astartes",
    "name": "Adept of the Codex",
    "detachment_id": "gladius-task-force",
    "cost": 20,
    "keyword_restrictions": [
      "Captain"
    ],
    "ability_id": "adept-of-the-codex-gladius-task-force-adeptus-astartes",
    "is_unique": true,
    "game_version": {
      "edition": "11th",
      "dataslate": "mfm-995"
    },
    "points_provisional": false,
    "upgrade_tag": false,
    "max_targets": 1,
    "external_refs": [
      {
        "namespace": "game-datacards",
        "id": "9cb3de18-43d4-5460-bdc2-6ae1e0ddf250"
      },
      {
        "namespace": "mfm",
        "id": "8fc10e42-2978-43da-92e9-636e5e4ce564"
      }
    ]
  }
]
